<tourcards  xmlns:tns="http://www.w3.org/2001/XMLSchema-instance"
            xmlns="https://www.example.com/tourcard"
            tns:schemaLocation="https://www.example.com/tourcard  TourCard.xsd ">
  <tourcard name="Hot relaxation in Egypt" price="780" login="HotEgyrt1" tourists="1" insurance="false">
    <place>
      <region>Hurgada</region>
      <city>Hurgada</city>
    </place>
    <time>
      <start>2019-09-12</start>
      <finish>2019-09-19</finish>
    </time>
    <category>sea</category>
    <excursion>
      <excursionname>Deep dive</excursionname>
      <excursionprice>30</excursionprice>
    </excursion>
    <excursion>
      <excursionname>Egyrt Pirmid</excursionname>
      <excursionprice>201</excursionprice>
    </excursion>
    <trip>
      <tripname>wild safary</tripname>
      <tripplace> sahara</tripplace>
      <tripprice>120</tripprice>
    </trip>
    <transport>airplane</transport>
  </tourcard>
  <tourcard name="so different Amsterdam" price="1400" login="DreamAmster1" tourists="1" insurance="false">
    <place>
      <region>North holland</region>
      <city>Amsterdam</city>
    </place>
    <time>
      <start>2019-09-12</start>
      <finish>2019-09-19</finish>
    </time>
    <category>shopping</category>
    <excursion>
      <excursionname>Madame Tussauds museum</excursionname>
      <excursionprice>30</excursionprice>
    </excursion>
    <excursion>
      <excursionname>Big Russian Boss</excursionname>
      <excursionprice>201</excursionprice>
    </excursion>
    <trip>
      <tripname>wild safary</tripname>
      <tripplace> sahara</tripplace>
      <tripprice>120</tripprice>
    </trip>
    <transport>bus</transport>
  </tourcard>
</tourcards>